{
  "run_id": "m0-YYYYMMDD-scenario-config",
  "timestamp_start_iso": "2026-03-11T00:00:00Z",
  "timestamp_end_iso": "2026-03-11T00:30:00Z",
  "scenario_id": "S4_mixed_soak_30m",
  "config_id": "CFG-B",
  "config": {
    "frame_size_ms": 20,
    "mix_cadence_ms": 100,
    "sample_rate_hz": 16000,
    "channels": 1,
    "format": "PCM16"
  },
  "environment": {
    "macos_version": "",
    "hardware_model": "",
    "architecture": "",
    "node_version": "",
    "electron_version": "",
    "audioteejs_version": "",
    "deepgram_mode": ""
  },
  "operator": "",
  "commit_ref": "",
  "notes": ""
}
