{
  "run_id": "m0-20260312-s5-network-drop-cfg-b-batch-2026-03-12t05-15-56-096z",
  "timestamp_start_iso": "2026-03-12T05:17:12.172Z",
  "timestamp_end_iso": "2026-03-12T05:17:32.175Z",
  "scenario_id": "S5_network_drop",
  "config_id": "CFG-B",
  "config": {
    "frame_size_ms": 20,
    "mix_cadence_ms": 100,
    "sample_rate_hz": 16000,
    "channels": 1,
    "format": "PCM16"
  },
  "environment": {
    "macos_version": "redacted",
    "hardware_model": "redacted",
    "architecture": "arm64",
    "node_version": "redacted",
    "electron_version": "",
    "audioteejs_version": "",
    "deepgram_mode": "mock"
  },
  "operator": "hao",
  "commit_ref": "",
  "notes": "Generated by spike/m0-harness bootstrap."
}